boundary_id,scenario_id,boundary_name,source_modules,proposed_interface,side_effect_policy,idempotency_key,extraction_reason,risk_level,reviewer_action
BND-01,SCN-100,webhook-ingress-normalizer,"Webhook; Parse JSON; Set tenant/request fields","normalized_payload, tenant_id, request_id","no side effects","tenant_id:request_id","Multiple scenarios parse the same lead payload differently",low,"Approve extraction after three sample payload tests"
BND-02,SCN-100,lead-eligibility-gate,"Filter; router; required-field checks; duplicate search","eligible_lead, blocked_reason, ledger_status","blocks before side effects","tenant_id:request_id:eligibility","Eligibility should run before enrichment or CRM writes",medium,"Review blocked reasons before enabling live writes"
BND-03,SCN-200,enrichment-cache-lookup,"Airtable search; cache freshness check; dedupe branch","cache_hit, source_record_id, cached_profile","read and cache write only","source_record_id:profile_version","Repeated vendor calls need a shared cache decision",low,"Approve cache TTL and stale profile behavior"
BND-04,SCN-200,vendor-enrichment-worker,"HTTP vendor call; LLM summary; company profile update","profile_payload, vendor_status, usage_count","side effects behind approval gate","source_record_id:vendor:run_date","Expensive vendor and LLM calls should sit behind a reusable gate",high,"Dry-run first and compare usage counts before live update"
BND-05,SCN-300,invoice-preflight-ledger,"Attachment parse; vendor map lookup; PO lookup","invoice_key, vendor_status, po_status, exception_reason","blocks before notifications","vendor_id:invoice_number:amount","Duplicate invoices and missing mappings need a ledger before notifications",medium,"Approve exception categories and replay rule"
BND-06,SCN-400,exec-report-builder,"Query rows; format report; Slack delivery","report_markdown, report_window","single-scenario side effect","report_window:channel","Not reused enough to extract in the first pass",low,"Leave inline and document naming only"
